{
  "schemaVersion": 2,
  "capsuleId": "0d95b7c1-7ce9-4a91-aea2-b64707a05c9f",
  "revision": 2,
  "durationMs": 8000,
  "status": "queued",
  "audioFile": "audio.m4a",
  "audioFormat": "m4a-aac-lc",
  "sampleRateHz": 16000,
  "channels": 1,
  "bitsPerSample": 16,
  "rawTextFile": null,
  "polishedTextFile": null,
  "attempts": 0
}
